{
  "signatureDate": "2025-04-22",
  "prescriptionID": "RX987654321",
  "prescribedMedication": {
    "name": "Paracetamol 500 mg Tabletten",
    "dosageForm": "Tablette",
    "quantity": 10,
    "dosage": "1-1-1-1 nach Bedarf",
    "duration": "5 Tage"
  },
  "dispensedMedication": {
    "name": "Paracetamol 500 mg Tabletten",
    "dosageForm": "Tablette",
    "quantity": 10,
    "dosage": "1-1-1-1 nach Bedarf"
  },
  "pharmacy": {
    "name": "Stadt-Apotheke",
    "address": "Hauptstra√üe 10, 54321 Beispielstadt",
    "phone": "+49 987 6543210"
  },
  "dispenseDate": "2025-04-21",
  "confirmations": {
    "safetyMeasures": true,
    "informationMaterial": true,
    "offLabelUse": false,
    "prescriptionForWoman": false,
    "expertiseConfirmation": true
  }
}
